{
  "feedback_type": "review_feedback",
  "review_id": "PEH-EVAL-REVIEW-001",
  "task_id": "PEH-EVAL-001",
  "task_version": 1,
  "reviewer_id": "chat-gpt5-local",
  "reviewed_commit": "374f07b7ede3593400bf8631994fb1e91a4123bd",
  "review_state": "changes_required",
  "blocking_findings": [
    "Validator does not enforce strict types for review_feedback",
    "Missing executor_switch_checkpoint schema"
  ],
  "non_blocking_findings": [
    "CHANGELOG entry could be more detailed"
  ],
  "required_changes": [
    "Add strict type assertions to validator",
    "Add review_feedback and executor_switch_checkpoint schemas",
    "Add missing examples and negative tests"
  ],
  "unchanged_scope": [
    "SKILL.md",
    "AGENTS.md",
    "references/"
  ],
  "resume_from": "Continue on knowledge-rebuild-v2 at 2c365d3.",
  "new_authorization": [
    "Modify validate-handoff.mjs",
    "Create new schema and example files"
  ],
  "next_required_action": "Executor must implement the required changes and return Execution Result."
}
